{
    "$schema": "http://json-schema.org/draft-07/schema#",
    "properties": {
        "_id": {
            "type": "number"
        },
        "description": {
            "type": "string"
        },
        "id": {
            "type": "string"
        },
        "name": {
            "type": "string"
        },
        "rarity": {
            "type": "number"
        },
        "source": {
            "items": {
                "type": "string"
            },
            "type": "array"
        }
    },
    "required": [
        "_id",
        "description",
        "id",
        "name",
        "rarity",
        "source"
    ],
    "type": "object"
}

