{
  "_id": 112092,
  "id": "old_operatives_pocket_watch",
  "name": "Reloj de bolsillo vetusto de Senescal",
  "description": "El desgaste y el óxido de la insignia de la carcasa reflejan fielmente sus días como ejecutoras.",
  "source": [
    "Obtenido de Soldados Fatui - Senescales",
    "Canjear Polvo estelar"
  ],
  "rarity": 2
}
